category,prefecture,store_name,address,phone
自転車販売店,岡山県,倉敷市東部埋立事業所,岡山県倉敷市二子１９１７－４,086-463-4125
自転車販売店,岡山県,倉敷市児島環境センター,岡山県倉敷市児島小川町３６９７－４,086-472-5166
自転車販売店,岡山県,（株）あさひサイクルベースあさひ倉敷北店,岡山県倉敷市宮前２５－１,086-435-7813
自転車販売店,岡山県,倉敷市水島環境センター,岡山県倉敷市水島川崎通１－１－１１０,086-444-6640
自転車販売店,岡山県,倉敷市玉島環境センター,岡山県倉敷市玉島乙島８２５５－４９,086-522-3844
自転車販売店,岡山県,倉敷市倉敷環境センター,岡山県倉敷市白楽町４２４,086-426-3371
自転車販売店,岡山県,（株）あさひサイクルベースあさひ倉敷笹沖店,岡山県倉敷市笹沖３９８－５,086-435-0731
自転車販売店,岡山県,備前市環境センター,岡山県備前市八木山８５９－１,0869-62-0894
自転車販売店,岡山県,川崎商会（株）,岡山県備前市日生町日生８８９－７,0869-72-1367
自転車販売店,岡山県,備前市市民生活部環境課,岡山県備前市東片上１２６＿２Ｆ,0869-64-1821
自転車販売店,岡山県,オートショップ　イシイ,岡山県加賀郡吉備中央町上竹１２６３－１,0866-54-1056
自転車販売店,岡山県,（株）あさひサイクルベースあさひ東岡山店,岡山県岡山市中区高屋２８４－１,086-270-5120
自転車販売店,岡山県,（株）あさひサイクルベースあさひ大安寺店,岡山県岡山市北区大安寺南町２－１－２７,086-251-6600
自転車販売店,岡山県,（株）あさひサイクルベースあさひ岡山津島店,岡山県岡山市北区津島西坂１－１－３１,086-898-3170
自転車販売店,岡山県,ビックカメラ岡山駅前店１階電動アシスト自転車用バッテリー売場,岡山県岡山市北区駅前町１－１－１,086-236-1111
自転車販売店,岡山県,（株）あさひサイクルベースあさひ岡山新保店,岡山県岡山市南区新保１１９５－３,086-235-2745
自転車販売店,岡山県,ベアーズサイクル,岡山県岡山市南区福島３－６－３６,086-262-0487
自転車販売店,岡山県,（有）アキヤマ,岡山県岡山市東区西大寺浜８８７－３,086-942-3059
自転車販売店,岡山県,（有）末沢商会,岡山県津山市材木町１９,0868-22-2868
自転車販売店,岡山県,津山圏域資源循環施設組合,岡山県津山市領家１４４６,0868-57-2221
自転車販売店,岡山県,真庭市生活環境部　クリーンセンターまにわ,岡山県真庭市樫西２９０,0867-42-7453
自転車販売店,岡山県,尾崎オートサイクルセンター,岡山県真庭市落合垂水４３１,0867-52-0254
自転車販売店,岡山県,サイクルハウス　ヨコヤマ,岡山県美作市平田６４,0868-72-0829
自転車販売店,岡山県,大森サイクルセンター,岡山県都窪郡早島町早島２３２０－１,086-482-0321
